{
  "paragraph": "Now, in the city, Mira, a internal affairs detective, must solve a police shooting before a deadline. When falling for the officer she's investigating forces Mira to commit, there is no turning back. After a brutal setback, Mira realizes the old belief was false and must now change tactics in line with the moral premise. Pressure escalates until only one final path remains, leaving no choice but to drive toward the endgame. In a final confrontation, Mira faces the opposition and wins, achieving the goal.",
  "moral_premise": "People succeed when they act with courage, and they fail when they protect themselves at the cost of justice.",
  "metadata": {
    "project_id": "smoketestnovel_20250819_141512",
    "step": 2,
    "version": "1.0.0",
    "created_at": "2025-08-19T14:16:09.431387",
    "model_name": "claude-3-5-sonnet-20241022",
    "temperature": 0.3,
    "seed": 42,
    "prompt_hash": "7490cbe211283bcb190a23d3076cc04751601b2890886f34758c82732dbc94ea",
    "validator_version": "1.0.0",
    "hash_upstream": "f8ecaad9bae74e69bb0059803b3e2d8ecbf2fbc727d0ed18b3fcfa52213c5b2b"
  },
  "sentences": {
    "all": [
      "Now, in the city, Mira, a internal affairs detective, must solve a police shooting before a deadline.",
      "When falling for the officer she's investigating forces Mira to commit, there is no turning back.",
      "After a brutal setback, Mira realizes the old belief was false and must now change tactics in line with the moral premise.",
      "Pressure escalates until only one final path remains, leaving no choice but to drive toward the endgame.",
      "In a final confrontation, Mira faces the opposition and wins, achieving the goal."
    ],
    "setup": "Now, in the city, Mira, a internal affairs detective, must solve a police shooting before a deadline.",
    "disaster_1": "When falling for the officer she's investigating forces Mira to commit, there is no turning back.",
    "disaster_2": "After a brutal setback, Mira realizes the old belief was false and must now change tactics in line with the moral premise.",
    "disaster_3": "Pressure escalates until only one final path remains, leaving no choice but to drive toward the endgame.",
    "resolution": "In a final confrontation, Mira faces the opposition and wins, achieving the goal."
  },
  "sentence_count": 5,
  "moral_pivot": {
    "pivot_shown": true,
    "false_belief": "protect themselves at the cost of justice",
    "true_belief": "act with courage"
  },
  "causality_check": {
    "has_coincidence": false,
    "causal_chain": true
  },
  "disasters": {
    "d1_present": true,
    "d2_present": true,
    "d3_present": true,
    "d1_type": "event",
    "d2_type": "event",
    "d3_type": "event"
  }
}