{
  "paragraph": "Now, in the city, Lena, a internal-affairs detective, must prove a fatal shooting was a cover-up before a deadline. When a police syndicate wiping digital evidence forces Lena to commit, there is no turning back. After a brutal setback, Lena realizes the old belief was false and must now change tactics in line with the moral premise. Pressure escalates until only one final path remains, leaving no choice but to drive toward the endgame. In a final confrontation, Lena faces the opposition and wins, achieving the goal.",
  "moral_premise": "People succeed when they act with courage, and they fail when they protect themselves at the cost of justice.",
  "metadata": {
    "project_id": "full_e2e_test_novel_20250821_002656",
    "step": 2,
    "version": "1.0.0",
    "created_at": "2025-08-21T00:32:34.905072",
    "model_name": "gpt-5",
    "temperature": 1.0,
    "seed": 42,
    "prompt_hash": "70aaf836afaa30f4d51a3f5d3b681132e4a71e1ebd50fd0ebd87c6b52ac879d1",
    "validator_version": "1.0.0",
    "hash_upstream": "3f073ecff88bafeca44eb0af47278f8a6b485e46344105d372ed24a737879a0d"
  },
  "sentences": {
    "all": [
      "Now, in the city, Lena, a internal-affairs detective, must prove a fatal shooting was a cover-up before a deadline.",
      "When a police syndicate wiping digital evidence forces Lena to commit, there is no turning back.",
      "After a brutal setback, Lena realizes the old belief was false and must now change tactics in line with the moral premise.",
      "Pressure escalates until only one final path remains, leaving no choice but to drive toward the endgame.",
      "In a final confrontation, Lena faces the opposition and wins, achieving the goal."
    ],
    "setup": "Now, in the city, Lena, a internal-affairs detective, must prove a fatal shooting was a cover-up before a deadline.",
    "disaster_1": "When a police syndicate wiping digital evidence forces Lena to commit, there is no turning back.",
    "disaster_2": "After a brutal setback, Lena realizes the old belief was false and must now change tactics in line with the moral premise.",
    "disaster_3": "Pressure escalates until only one final path remains, leaving no choice but to drive toward the endgame.",
    "resolution": "In a final confrontation, Lena faces the opposition and wins, achieving the goal."
  },
  "sentence_count": 5,
  "moral_pivot": {
    "pivot_shown": true,
    "false_belief": "protect themselves at the cost of justice",
    "true_belief": "act with courage"
  },
  "causality_check": {
    "has_coincidence": false,
    "causal_chain": true
  },
  "disasters": {
    "d1_present": true,
    "d2_present": true,
    "d3_present": true,
    "d1_type": "event",
    "d2_type": "event",
    "d3_type": "event"
  }
}