{
  "paragraph": "Now, in the city, Casey Chen, a junior data analyst, must steal back ten years of lifespan from LifeHock's vault before a deadline. When LifeHock's time-repo agents and a mentor's betrayal forces Casey Chen to commit, there is no turning back. After a brutal setback, Casey Chen realizes the old belief was false and must now change tactics in line with the moral premise. Pressure escalates until only one final path remains, leaving no choice but to drive toward the endgame. In a final confrontation, Casey Chen faces the opposition and wins, achieving the goal.",
  "moral_premise": "People succeed when they act with courage, and they fail when they protect themselves at the cost of justice.",
  "metadata": {
    "project_id": "the_immortality_tax_20250820_024905",
    "step": 2,
    "version": "1.0.0",
    "created_at": "2025-08-20T02:52:04.084728",
    "model_name": "gpt-5",
    "temperature": 1.0,
    "seed": 42,
    "prompt_hash": "357b2247469ba90df6cdbaceb1b9f14c3abc836c83f4e237593e95a78a9447e9",
    "validator_version": "1.0.0",
    "hash_upstream": "bf5c42a1ab6549e50c2c009ce3dee1bc688c3ac7e54acaa43e2fc1920778e638"
  },
  "sentences": {
    "all": [
      "Now, in the city, Casey Chen, a junior data analyst, must steal back ten years of lifespan from LifeHock's vault before a deadline.",
      "When LifeHock's time-repo agents and a mentor's betrayal forces Casey Chen to commit, there is no turning back.",
      "After a brutal setback, Casey Chen realizes the old belief was false and must now change tactics in line with the moral premise.",
      "Pressure escalates until only one final path remains, leaving no choice but to drive toward the endgame.",
      "In a final confrontation, Casey Chen faces the opposition and wins, achieving the goal."
    ],
    "setup": "Now, in the city, Casey Chen, a junior data analyst, must steal back ten years of lifespan from LifeHock's vault before a deadline.",
    "disaster_1": "When LifeHock's time-repo agents and a mentor's betrayal forces Casey Chen to commit, there is no turning back.",
    "disaster_2": "After a brutal setback, Casey Chen realizes the old belief was false and must now change tactics in line with the moral premise.",
    "disaster_3": "Pressure escalates until only one final path remains, leaving no choice but to drive toward the endgame.",
    "resolution": "In a final confrontation, Casey Chen faces the opposition and wins, achieving the goal."
  },
  "sentence_count": 5,
  "moral_pivot": {
    "pivot_shown": true,
    "false_belief": "protect themselves at the cost of justice",
    "true_belief": "act with courage"
  },
  "causality_check": {
    "has_coincidence": false,
    "causal_chain": true
  },
  "disasters": {
    "d1_present": true,
    "d2_present": true,
    "d3_present": true,
    "d1_type": "revelation",
    "d2_type": "event",
    "d3_type": "event"
  }
}