{
  "paragraph": "Now, in the city, Mara, a internal-affairs records auditor, must steal the banned-history archive before a deadline. When the regime's surveillance dragnet and a double agent inside her unit forces Mara to commit, there is no turning back. After a brutal setback, Mara realizes the old belief was false and must now change tactics in line with the moral premise. Pressure escalates until only one final path remains, leaving no choice but to drive toward the endgame. In a final confrontation, Mara faces the opposition and wins, achieving the goal.",
  "moral_premise": "People succeed when they act with courage, and they fail when they protect themselves at the cost of justice.",
  "metadata": {
    "project_id": "full_e2e_test_novel_20250821_110957",
    "step": 2,
    "version": "1.0.0",
    "created_at": "2025-08-21T11:29:39.832650",
    "model_name": "gpt-5",
    "temperature": 1.0,
    "seed": 42,
    "prompt_hash": "9732fe85a41cef0dc8722f0e9608ed93a1f375e22538af69f9fad79102425f29",
    "validator_version": "1.0.0",
    "hash_upstream": "6611063c5018cc6747343813ebf8076cca23db957d7c8089c8f90edd36776029"
  },
  "sentences": {
    "all": [
      "Now, in the city, Mara, a internal-affairs records auditor, must steal the banned-history archive before a deadline.",
      "When the regime's surveillance dragnet and a double agent inside her unit forces Mara to commit, there is no turning back.",
      "After a brutal setback, Mara realizes the old belief was false and must now change tactics in line with the moral premise.",
      "Pressure escalates until only one final path remains, leaving no choice but to drive toward the endgame.",
      "In a final confrontation, Mara faces the opposition and wins, achieving the goal."
    ],
    "setup": "Now, in the city, Mara, a internal-affairs records auditor, must steal the banned-history archive before a deadline.",
    "disaster_1": "When the regime's surveillance dragnet and a double agent inside her unit forces Mara to commit, there is no turning back.",
    "disaster_2": "After a brutal setback, Mara realizes the old belief was false and must now change tactics in line with the moral premise.",
    "disaster_3": "Pressure escalates until only one final path remains, leaving no choice but to drive toward the endgame.",
    "resolution": "In a final confrontation, Mara faces the opposition and wins, achieving the goal."
  },
  "sentence_count": 5,
  "moral_pivot": {
    "pivot_shown": true,
    "false_belief": "protect themselves at the cost of justice",
    "true_belief": "act with courage"
  },
  "causality_check": {
    "has_coincidence": false,
    "causal_chain": true
  },
  "disasters": {
    "d1_present": true,
    "d2_present": true,
    "d3_present": true,
    "d1_type": "event",
    "d2_type": "event",
    "d3_type": "event"
  }
}