{
  "paragraph": "Now, in the city, Maya, a internal-affairs detective, must prove a fatal police shooting was staged before a deadline. When a citywide manhunt led by her mentor and a corrupt task force forces Maya to commit, there is no turning back. After a brutal setback, Maya realizes the old belief was false and must now change tactics in line with the moral premise. Pressure escalates until only one final path remains, leaving no choice but to drive toward the endgame. In a final confrontation, Maya faces the opposition and wins, achieving the goal.",
  "moral_premise": "People succeed when they act with courage, and they fail when they protect themselves at the cost of justice.",
  "metadata": {
    "project_id": "full_e2e_test_novel_20250821_005322",
    "step": 2,
    "version": "1.0.0",
    "created_at": "2025-08-21T00:58:29.137452",
    "model_name": "gpt-5",
    "temperature": 1.0,
    "seed": 42,
    "prompt_hash": "776dd949864a59b31d055e7e2031f969a717b221bb27840d7a0526f99cb9e9c2",
    "validator_version": "1.0.0",
    "hash_upstream": "effa93d47446ecedaecb7ab565b9d8e7f3b2bf9608947de5cff5a20304b0f327"
  },
  "sentences": {
    "all": [
      "Now, in the city, Maya, a internal-affairs detective, must prove a fatal police shooting was staged before a deadline.",
      "When a citywide manhunt led by her mentor and a corrupt task force forces Maya to commit, there is no turning back.",
      "After a brutal setback, Maya realizes the old belief was false and must now change tactics in line with the moral premise.",
      "Pressure escalates until only one final path remains, leaving no choice but to drive toward the endgame.",
      "In a final confrontation, Maya faces the opposition and wins, achieving the goal."
    ],
    "setup": "Now, in the city, Maya, a internal-affairs detective, must prove a fatal police shooting was staged before a deadline.",
    "disaster_1": "When a citywide manhunt led by her mentor and a corrupt task force forces Maya to commit, there is no turning back.",
    "disaster_2": "After a brutal setback, Maya realizes the old belief was false and must now change tactics in line with the moral premise.",
    "disaster_3": "Pressure escalates until only one final path remains, leaving no choice but to drive toward the endgame.",
    "resolution": "In a final confrontation, Maya faces the opposition and wins, achieving the goal."
  },
  "sentence_count": 5,
  "moral_pivot": {
    "pivot_shown": true,
    "false_belief": "protect themselves at the cost of justice",
    "true_belief": "act with courage"
  },
  "causality_check": {
    "has_coincidence": false,
    "causal_chain": true
  },
  "disasters": {
    "d1_present": true,
    "d2_present": true,
    "d3_present": true,
    "d1_type": "event",
    "d2_type": "event",
    "d3_type": "event"
  }
}