{
  "paragraph": "Now, in the city, Maya, a internal-affairs detective, must expose the officers who staged a shooting before a deadline. When the police union and command staff stonewalling her case forces Maya to commit, there is no turning back. After a brutal setback, Maya realizes the old belief was false and must now change tactics in line with the moral premise. Pressure escalates until only one final path remains, leaving no choice but to drive toward the endgame. In a final confrontation, Maya faces the opposition and wins, achieving the goal.",
  "moral_premise": "People succeed when they act with courage, and they fail when they protect themselves at the cost of justice.",
  "metadata": {
    "project_id": "monitored_e2e_test_novel_20250821_154550",
    "step": 2,
    "version": "1.0.0",
    "created_at": "2025-08-21T15:48:56.199192",
    "model_name": "gpt-5",
    "temperature": 1.0,
    "seed": 42,
    "prompt_hash": "b7d3802495c2eeee86822beb3e224c49c7935d6ec41f45b39eeab770f33b0a5a",
    "validator_version": "1.0.0",
    "hash_upstream": "b435e3870dc256b287e914dc5f30be0d251cfef9844b56de20d746c23f9c22bc"
  },
  "sentences": {
    "all": [
      "Now, in the city, Maya, a internal-affairs detective, must expose the officers who staged a shooting before a deadline.",
      "When the police union and command staff stonewalling her case forces Maya to commit, there is no turning back.",
      "After a brutal setback, Maya realizes the old belief was false and must now change tactics in line with the moral premise.",
      "Pressure escalates until only one final path remains, leaving no choice but to drive toward the endgame.",
      "In a final confrontation, Maya faces the opposition and wins, achieving the goal."
    ],
    "setup": "Now, in the city, Maya, a internal-affairs detective, must expose the officers who staged a shooting before a deadline.",
    "disaster_1": "When the police union and command staff stonewalling her case forces Maya to commit, there is no turning back.",
    "disaster_2": "After a brutal setback, Maya realizes the old belief was false and must now change tactics in line with the moral premise.",
    "disaster_3": "Pressure escalates until only one final path remains, leaving no choice but to drive toward the endgame.",
    "resolution": "In a final confrontation, Maya faces the opposition and wins, achieving the goal."
  },
  "sentence_count": 5,
  "moral_pivot": {
    "pivot_shown": true,
    "false_belief": "protect themselves at the cost of justice",
    "true_belief": "act with courage"
  },
  "causality_check": {
    "has_coincidence": false,
    "causal_chain": true
  },
  "disasters": {
    "d1_present": true,
    "d2_present": true,
    "d3_present": true,
    "d1_type": "event",
    "d2_type": "event",
    "d3_type": "event"
  }
}