{
  "paragraph": "Now, in the city, Emily, a cybersecurity expert, must expose a deadly conspiracy before a deadline. When being targeted by her CEO and a mysterious government agent forces Emily to commit, there is no turning back. After a brutal setback, Emily realizes the old belief was false and must now change tactics in line with the moral premise. Pressure escalates until only one final path remains, leaving no choice but to drive toward the endgame. In a final confrontation, Emily faces the opposition and wins, achieving the goal.",
  "moral_premise": "People succeed when they act with courage, and they fail when they protect themselves at the cost of justice.",
  "metadata": {
    "project_id": "code_of_deception_20250821_212841",
    "step": 2,
    "version": "1.0.0",
    "created_at": "2025-08-21T21:32:42.037585",
    "model_name": "gpt-4o-mini",
    "temperature": 0.3,
    "seed": 42,
    "prompt_hash": "ac5431d99e7212f16e91f5788794097cea1e7c3ca3ff7bd7ec00b7a6745d6b60",
    "validator_version": "1.0.0",
    "hash_upstream": "dee108496640634fd905dabfdd0b410b4b76b1ba5e1aa5655775675e2e3e5667"
  },
  "sentences": {
    "all": [
      "Now, in the city, Emily, a cybersecurity expert, must expose a deadly conspiracy before a deadline.",
      "When being targeted by her CEO and a mysterious government agent forces Emily to commit, there is no turning back.",
      "After a brutal setback, Emily realizes the old belief was false and must now change tactics in line with the moral premise.",
      "Pressure escalates until only one final path remains, leaving no choice but to drive toward the endgame.",
      "In a final confrontation, Emily faces the opposition and wins, achieving the goal."
    ],
    "setup": "Now, in the city, Emily, a cybersecurity expert, must expose a deadly conspiracy before a deadline.",
    "disaster_1": "When being targeted by her CEO and a mysterious government agent forces Emily to commit, there is no turning back.",
    "disaster_2": "After a brutal setback, Emily realizes the old belief was false and must now change tactics in line with the moral premise.",
    "disaster_3": "Pressure escalates until only one final path remains, leaving no choice but to drive toward the endgame.",
    "resolution": "In a final confrontation, Emily faces the opposition and wins, achieving the goal."
  },
  "sentence_count": 5,
  "causality_check": {
    "has_coincidence": false,
    "causal_chain": true
  },
  "disasters": {
    "d1_present": true,
    "d2_present": true,
    "d3_present": true,
    "d1_type": "event",
    "d2_type": "event",
    "d3_type": "event"
  },
  "moral_pivot": {
    "pivot_shown": true,
    "false_belief": "protect themselves at the cost of justice",
    "true_belief": "act with courage"
  }
}