{
  "paragraph": "Now, in the city, Sarah Chen, a internal affairs detective, must expose a corrupt police captain before a deadline. When threats to her career and life forces Sarah Chen to commit, there is no turning back. After a brutal setback, Sarah Chen realizes the old belief was false and must now change tactics in line with the moral premise. Pressure escalates until only one final path remains, leaving no choice but to drive toward the endgame. In a final confrontation, Sarah Chen faces the opposition and wins, achieving the goal.",
  "moral_premise": "People succeed when they act with courage, and they fail when they protect themselves at the cost of justice.",
  "metadata": {
    "project_id": "full_e2e_test_novel_20250819_175503",
    "step": 2,
    "version": "1.0.0",
    "created_at": "2025-08-19T17:55:49.996522",
    "model_name": "claude-3-5-sonnet-20241022",
    "temperature": 0.3,
    "seed": 42,
    "prompt_hash": "a4fdc7de1fced476765d60d14633f182fcc3e737851caecf19921662bf074995",
    "validator_version": "1.0.0",
    "hash_upstream": "78e786ad8a3522b96f8952a29b3775c8c786c66b56b0285ad89fdfcbdea811ca"
  },
  "sentences": {
    "all": [
      "Now, in the city, Sarah Chen, a internal affairs detective, must expose a corrupt police captain before a deadline.",
      "When threats to her career and life forces Sarah Chen to commit, there is no turning back.",
      "After a brutal setback, Sarah Chen realizes the old belief was false and must now change tactics in line with the moral premise.",
      "Pressure escalates until only one final path remains, leaving no choice but to drive toward the endgame.",
      "In a final confrontation, Sarah Chen faces the opposition and wins, achieving the goal."
    ],
    "setup": "Now, in the city, Sarah Chen, a internal affairs detective, must expose a corrupt police captain before a deadline.",
    "disaster_1": "When threats to her career and life forces Sarah Chen to commit, there is no turning back.",
    "disaster_2": "After a brutal setback, Sarah Chen realizes the old belief was false and must now change tactics in line with the moral premise.",
    "disaster_3": "Pressure escalates until only one final path remains, leaving no choice but to drive toward the endgame.",
    "resolution": "In a final confrontation, Sarah Chen faces the opposition and wins, achieving the goal."
  },
  "sentence_count": 5,
  "moral_pivot": {
    "pivot_shown": true,
    "false_belief": "protect themselves at the cost of justice",
    "true_belief": "act with courage"
  },
  "causality_check": {
    "has_coincidence": false,
    "causal_chain": true
  },
  "disasters": {
    "d1_present": true,
    "d2_present": true,
    "d3_present": true,
    "d1_type": "event",
    "d2_type": "event",
    "d3_type": "event"
  }
}