{
  "paragraph": "Now, in the city, Rae, a internal-affairs detective, must expose a municipal security-contract kickback scheme before a deadline. When being assigned to guard her prime suspect from the firm's hit team forces Rae to commit, there is no turning back. After a brutal setback, Rae realizes the old belief was false and must now change tactics in line with the moral premise. Pressure escalates until only one final path remains, leaving no choice but to drive toward the endgame. In a final confrontation, Rae faces the opposition and wins, achieving the goal.",
  "moral_premise": "People succeed when they act with courage, and they fail when they protect themselves at the cost of justice.",
  "metadata": {
    "project_id": "e2e_novel_20250821_151542",
    "step": 2,
    "version": "1.0.0",
    "created_at": "2025-08-21T15:18:53.678198",
    "model_name": "gpt-5",
    "temperature": 1.0,
    "seed": 42,
    "prompt_hash": "13579d4c5236f7d8f36fc884d5f14294a4c9737d4e7f02478e245bde281f768c",
    "validator_version": "1.0.0",
    "hash_upstream": "c064aafaa01c38afec4eab1eb4c324ad763001532e99cb5931ccb96afd0cd185"
  },
  "sentences": {
    "all": [
      "Now, in the city, Rae, a internal-affairs detective, must expose a municipal security-contract kickback scheme before a deadline.",
      "When being assigned to guard her prime suspect from the firm's hit team forces Rae to commit, there is no turning back.",
      "After a brutal setback, Rae realizes the old belief was false and must now change tactics in line with the moral premise.",
      "Pressure escalates until only one final path remains, leaving no choice but to drive toward the endgame.",
      "In a final confrontation, Rae faces the opposition and wins, achieving the goal."
    ],
    "setup": "Now, in the city, Rae, a internal-affairs detective, must expose a municipal security-contract kickback scheme before a deadline.",
    "disaster_1": "When being assigned to guard her prime suspect from the firm's hit team forces Rae to commit, there is no turning back.",
    "disaster_2": "After a brutal setback, Rae realizes the old belief was false and must now change tactics in line with the moral premise.",
    "disaster_3": "Pressure escalates until only one final path remains, leaving no choice but to drive toward the endgame.",
    "resolution": "In a final confrontation, Rae faces the opposition and wins, achieving the goal."
  },
  "sentence_count": 5,
  "moral_pivot": {
    "pivot_shown": true,
    "false_belief": "protect themselves at the cost of justice",
    "true_belief": "act with courage"
  },
  "causality_check": {
    "has_coincidence": false,
    "causal_chain": true
  },
  "disasters": {
    "d1_present": true,
    "d2_present": true,
    "d3_present": true,
    "d1_type": "event",
    "d2_type": "event",
    "d3_type": "event"
  }
}