{
  "paragraph": "Now, in the city, Casey Chen, a life-debtor, must steal back ten years from LifeHock's vault before a deadline. When the life-harvesting regime's time-repo agents forces Casey Chen to commit, there is no turning back. After a brutal setback, Casey Chen realizes the old belief was false and must now change tactics in line with the moral premise. Pressure escalates until only one final path remains, leaving no choice but to drive toward the endgame. In a final confrontation, Casey Chen faces the opposition and wins, achieving the goal.",
  "moral_premise": "People succeed when they act with courage, and they fail when they protect themselves at the cost of justice.",
  "metadata": {
    "project_id": "the_immortality_tax_20250821_161814",
    "step": 2,
    "version": "1.0.0",
    "created_at": "2025-08-21T16:22:22.945992",
    "model_name": "gpt-5",
    "temperature": 1.0,
    "seed": 42,
    "prompt_hash": "90767a3883e1280aceb9e1762f77827989d867578e35d73b963cc9ba04f8be72",
    "validator_version": "1.0.0",
    "hash_upstream": "7b3e22be424f5fd1e8c7edde092cc184c2ca750fa674aa5d8d96f0df82e4a567"
  },
  "sentences": {
    "all": [
      "Now, in the city, Casey Chen, a life-debtor, must steal back ten years from LifeHock's vault before a deadline.",
      "When the life-harvesting regime's time-repo agents forces Casey Chen to commit, there is no turning back.",
      "After a brutal setback, Casey Chen realizes the old belief was false and must now change tactics in line with the moral premise.",
      "Pressure escalates until only one final path remains, leaving no choice but to drive toward the endgame.",
      "In a final confrontation, Casey Chen faces the opposition and wins, achieving the goal."
    ],
    "setup": "Now, in the city, Casey Chen, a life-debtor, must steal back ten years from LifeHock's vault before a deadline.",
    "disaster_1": "When the life-harvesting regime's time-repo agents forces Casey Chen to commit, there is no turning back.",
    "disaster_2": "After a brutal setback, Casey Chen realizes the old belief was false and must now change tactics in line with the moral premise.",
    "disaster_3": "Pressure escalates until only one final path remains, leaving no choice but to drive toward the endgame.",
    "resolution": "In a final confrontation, Casey Chen faces the opposition and wins, achieving the goal."
  },
  "sentence_count": 5,
  "moral_pivot": {
    "pivot_shown": true,
    "false_belief": "protect themselves at the cost of justice",
    "true_belief": "act with courage"
  },
  "causality_check": {
    "has_coincidence": false,
    "causal_chain": true
  },
  "disasters": {
    "d1_present": true,
    "d2_present": true,
    "d3_present": true,
    "d1_type": "event",
    "d2_type": "event",
    "d3_type": "event"
  }
}