{
  "paragraph": "Now, in the city, Maya, a homicide detective, must solve a corporate murder before a deadline. When falling for her prime suspect, tech CEO James Chen forces Maya to commit, there is no turning back. After a brutal setback, Maya realizes the old belief was false and must now change tactics in line with the moral premise. Pressure escalates until only one final path remains, leaving no choice but to drive toward the endgame. In a final confrontation, Maya faces the opposition and wins, achieving the goal.",
  "moral_premise": "People succeed when they act with courage, and they fail when they protect themselves at the cost of justice.",
  "metadata": {
    "project_id": "e2e_novel_20250819_153116",
    "step": 2,
    "version": "1.0.0",
    "created_at": "2025-08-19T15:32:05.890022",
    "model_name": "claude-3-5-sonnet-20241022",
    "temperature": 0.3,
    "seed": 42,
    "prompt_hash": "fecb5477d5e11e4a8f24eea916eeff5c1c8e64817e17f97356353f932b2c3966",
    "validator_version": "1.0.0",
    "hash_upstream": "609a0eadae70987af949a10e258297f51cbcb0aca820d69e132dc9df234f0ccb"
  },
  "sentences": {
    "all": [
      "Now, in the city, Maya, a homicide detective, must solve a corporate murder before a deadline.",
      "When falling for her prime suspect, tech CEO James Chen forces Maya to commit, there is no turning back.",
      "After a brutal setback, Maya realizes the old belief was false and must now change tactics in line with the moral premise.",
      "Pressure escalates until only one final path remains, leaving no choice but to drive toward the endgame.",
      "In a final confrontation, Maya faces the opposition and wins, achieving the goal."
    ],
    "setup": "Now, in the city, Maya, a homicide detective, must solve a corporate murder before a deadline.",
    "disaster_1": "When falling for her prime suspect, tech CEO James Chen forces Maya to commit, there is no turning back.",
    "disaster_2": "After a brutal setback, Maya realizes the old belief was false and must now change tactics in line with the moral premise.",
    "disaster_3": "Pressure escalates until only one final path remains, leaving no choice but to drive toward the endgame.",
    "resolution": "In a final confrontation, Maya faces the opposition and wins, achieving the goal."
  },
  "sentence_count": 5,
  "causality_check": {
    "has_coincidence": false,
    "causal_chain": true
  },
  "disasters": {
    "d1_present": true,
    "d2_present": true,
    "d3_present": true,
    "d1_type": "event",
    "d2_type": "event",
    "d3_type": "event"
  },
  "moral_pivot": {
    "pivot_shown": true,
    "false_belief": "protect themselves at the cost of justice",
    "true_belief": "act with courage"
  }
}